[
  {
    "format_version": 1,
    "kind": "project-memory",
    "id": "memory:candidate:strict-query-boundary",
    "memory_class": "reusable_lesson",
    "state": "candidate",
    "statement": "Repository query adapters may require canonical domain tokens rather than presentation labels.",
    "scope": {
      "project_id": "project:agentic-harness",
      "repositories": [
        "powerpuff-kitty/agentic-harness"
      ],
      "paths": [
        "registry/"
      ],
      "tags": [
        "query-boundary"
      ]
    },
    "source": {
      "kind": "reflection",
      "source_refs": [
        "reflection:test-failure:1"
      ],
      "evidence_refs": [
        "evidence:test-failure",
        "evidence:repository-query-contract"
      ],
      "created_by": "agentic-harness/reflection"
    },
    "validity": {
      "status": "current",
      "valid_from": "2026-09-21T20:02:00Z",
      "valid_until": null,
      "last_verified_at": "2026-09-21T20:04:05Z"
    },
    "confidence": 0.92,
    "importance": 0.7,
    "sensitivity": {
      "level": "project",
      "remote_persistence_allowed": true,
      "remote_retrieval_allowed": true
    },
    "usage": {
      "retrieval_count": 0,
      "last_retrieved_at": null
    },
    "lineage": {
      "supersedes": [],
      "superseded_by": null,
      "invalidates": [],
      "invalidated_by": null,
      "consolidated_from": [],
      "consolidated_into": null,
      "conflicts_with": []
    },
    "created_at": "2026-09-21T20:05:00Z",
    "updated_at": "2026-09-21T20:05:00Z"
  },
  {
    "format_version": 1,
    "kind": "project-memory",
    "id": "memory:local-only:auth-note",
    "memory_class": "constraint_gotcha",
    "state": "accepted",
    "statement": "Local development authentication uses a machine-local credential reference that must never be sent to remote providers.",
    "scope": {
      "project_id": "project:agentic-harness",
      "repositories": [
        "powerpuff-kitty/agentic-harness"
      ],
      "paths": [
        ".agentic/"
      ],
      "tags": [
        "auth",
        "local-only"
      ]
    },
    "source": {
      "kind": "human",
      "source_refs": [
        "decision:local-auth-policy"
      ],
      "evidence_refs": [],
      "created_by": "project-maintainer"
    },
    "validity": {
      "status": "current",
      "valid_from": "2026-09-21T20:10:00Z",
      "valid_until": null,
      "last_verified_at": "2026-09-21T20:10:00Z"
    },
    "confidence": 1,
    "importance": 1,
    "sensitivity": {
      "level": "local_only",
      "remote_persistence_allowed": false,
      "remote_retrieval_allowed": false
    },
    "usage": {
      "retrieval_count": 2,
      "last_retrieved_at": "2026-09-21T20:20:00Z"
    },
    "lineage": {
      "supersedes": [],
      "superseded_by": null,
      "invalidates": [],
      "invalidated_by": null,
      "consolidated_from": [],
      "consolidated_into": null,
      "conflicts_with": []
    },
    "created_at": "2026-09-21T20:10:00Z",
    "updated_at": "2026-09-21T20:20:00Z"
  },
  {
    "format_version": 1,
    "kind": "project-memory",
    "id": "memory:stale:cli-install-path",
    "memory_class": "validated_observation",
    "state": "stale",
    "statement": "The CLI installer writes binaries to the legacy project-local bin directory.",
    "scope": {
      "project_id": "project:agentic-harness",
      "repositories": [
        "powerpuff-kitty/agentic-harness-cli"
      ],
      "paths": [
        "src/install/"
      ],
      "tags": [
        "cli",
        "installer"
      ]
    },
    "source": {
      "kind": "evidence",
      "source_refs": [
        "evidence:installer-snapshot:old"
      ],
      "evidence_refs": [
        "evidence:installer-snapshot:old"
      ],
      "created_by": "agentic-harness/repository-intelligence"
    },
    "validity": {
      "status": "stale",
      "valid_from": "2026-09-01T00:00:00Z",
      "valid_until": null,
      "last_verified_at": "2026-09-10T00:00:00Z"
    },
    "confidence": 0.6,
    "importance": 0.4,
    "sensitivity": {
      "level": "project",
      "remote_persistence_allowed": true,
      "remote_retrieval_allowed": true
    },
    "usage": {
      "retrieval_count": 8,
      "last_retrieved_at": "2026-09-15T00:00:00Z"
    },
    "lineage": {
      "supersedes": [],
      "superseded_by": null,
      "invalidates": [],
      "invalidated_by": null,
      "consolidated_from": [],
      "consolidated_into": null,
      "conflicts_with": []
    },
    "created_at": "2026-09-01T00:00:00Z",
    "updated_at": "2026-09-15T00:00:00Z"
  },
  {
    "format_version": 1,
    "kind": "project-memory",
    "id": "memory:conflict:a",
    "memory_class": "architectural_decision",
    "state": "accepted",
    "statement": "Repository-derived context should be cached for one hour by default.",
    "scope": {
      "project_id": "project:agentic-harness",
      "repositories": [
        "powerpuff-kitty/agentic-harness"
      ],
      "paths": [
        "catalog/schema/"
      ],
      "tags": [
        "cache"
      ]
    },
    "source": {
      "kind": "decision",
      "source_refs": [
        "decision:cache-policy:a"
      ],
      "evidence_refs": [],
      "created_by": "architecture-review"
    },
    "validity": {
      "status": "current",
      "valid_from": "2026-09-18T00:00:00Z",
      "valid_until": null,
      "last_verified_at": "2026-09-18T00:00:00Z"
    },
    "confidence": 0.8,
    "importance": 0.6,
    "sensitivity": {
      "level": "project",
      "remote_persistence_allowed": true,
      "remote_retrieval_allowed": true
    },
    "usage": {
      "retrieval_count": 1,
      "last_retrieved_at": "2026-09-20T00:00:00Z"
    },
    "lineage": {
      "supersedes": [],
      "superseded_by": null,
      "invalidates": [],
      "invalidated_by": null,
      "consolidated_from": [],
      "consolidated_into": null,
      "conflicts_with": [
        "memory:conflict:b"
      ]
    },
    "created_at": "2026-09-18T00:00:00Z",
    "updated_at": "2026-09-20T00:00:00Z"
  },
  {
    "format_version": 1,
    "kind": "project-memory",
    "id": "memory:conflict:b",
    "memory_class": "architectural_decision",
    "state": "accepted",
    "statement": "Repository-derived context should be invalidated immediately on source digest change with no time-based default.",
    "scope": {
      "project_id": "project:agentic-harness",
      "repositories": [
        "powerpuff-kitty/agentic-harness"
      ],
      "paths": [
        "catalog/schema/"
      ],
      "tags": [
        "cache"
      ]
    },
    "source": {
      "kind": "decision",
      "source_refs": [
        "decision:cache-policy:b"
      ],
      "evidence_refs": [],
      "created_by": "architecture-review"
    },
    "validity": {
      "status": "current",
      "valid_from": "2026-09-19T00:00:00Z",
      "valid_until": null,
      "last_verified_at": "2026-09-19T00:00:00Z"
    },
    "confidence": 0.9,
    "importance": 0.7,
    "sensitivity": {
      "level": "project",
      "remote_persistence_allowed": true,
      "remote_retrieval_allowed": true
    },
    "usage": {
      "retrieval_count": 1,
      "last_retrieved_at": "2026-09-20T00:00:00Z"
    },
    "lineage": {
      "supersedes": [],
      "superseded_by": null,
      "invalidates": [],
      "invalidated_by": null,
      "consolidated_from": [],
      "consolidated_into": null,
      "conflicts_with": [
        "memory:conflict:a"
      ]
    },
    "created_at": "2026-09-19T00:00:00Z",
    "updated_at": "2026-09-20T00:00:00Z"
  },
  {
    "format_version": 1,
    "kind": "project-memory",
    "id": "memory:superseded:old",
    "memory_class": "procedural_knowledge",
    "state": "superseded",
    "statement": "Run the legacy full-context export before every audit.",
    "scope": {
      "project_id": "project:agentic-harness",
      "repositories": [
        "powerpuff-kitty/agentic-harness"
      ],
      "paths": [
        ".agentic/"
      ],
      "tags": [
        "context"
      ]
    },
    "source": {
      "kind": "human",
      "source_refs": [
        "decision:context-workflow:old"
      ],
      "evidence_refs": [],
      "created_by": "project-maintainer"
    },
    "validity": {
      "status": "stale",
      "valid_from": "2026-09-01T00:00:00Z",
      "valid_until": "2026-09-20T00:00:00Z",
      "last_verified_at": "2026-09-15T00:00:00Z"
    },
    "confidence": 1,
    "importance": 0.8,
    "sensitivity": {
      "level": "project",
      "remote_persistence_allowed": true,
      "remote_retrieval_allowed": true
    },
    "usage": {
      "retrieval_count": 14,
      "last_retrieved_at": "2026-09-19T00:00:00Z"
    },
    "lineage": {
      "supersedes": [],
      "superseded_by": "memory:superseded:new",
      "invalidates": [],
      "invalidated_by": null,
      "consolidated_from": [],
      "consolidated_into": null,
      "conflicts_with": []
    },
    "created_at": "2026-09-01T00:00:00Z",
    "updated_at": "2026-09-20T00:00:00Z"
  },
  {
    "format_version": 1,
    "kind": "project-memory",
    "id": "memory:superseded:new",
    "memory_class": "procedural_knowledge",
    "state": "accepted",
    "statement": "Compile task-scoped context first and disclose full files only when required.",
    "scope": {
      "project_id": "project:agentic-harness",
      "repositories": [
        "powerpuff-kitty/agentic-harness"
      ],
      "paths": [
        ".agentic/docs/architecture/context-compiler.md"
      ],
      "tags": [
        "context"
      ]
    },
    "source": {
      "kind": "decision",
      "source_refs": [
        "decision:context-workflow:new"
      ],
      "evidence_refs": [
        "evidence:context-compiler-contract"
      ],
      "created_by": "architecture-review"
    },
    "validity": {
      "status": "current",
      "valid_from": "2026-09-20T00:00:00Z",
      "valid_until": null,
      "last_verified_at": "2026-09-20T00:00:00Z"
    },